{"analysis_scope_digest":"7b47e00a7c7544149d5957ff918c13b3efb115665cac71774408157ecd00d8d1","artifact_kind":"DERIVATION_EVIDENCE","canonicalization_profile":"veritrail-json-c14n/1","derivation_evidence_digest":"c73abaf9b62ca18ad47355c2a4cd0dcdfcdd156be36ff3869919771b272cb723","derivation_id":"fixture-derivation-001","derivation_profile_digest":"e8bbe54140ff2a082b69d6b6967d8630a423abd135ac6e7be0badc1fe053125b","diagnostics":[],"finished_at":"2026-09-10T00:00:03Z","overall_execution_status":"COMPLETED","policy_digest":"ba5d50b166e56a5d8ee3fd8fd56841e8008dd43196c1547840810eb3e6209c4a","provider_runs":[{"capability_id":"python-ast","diagnostics":[],"execution_status":"COMPLETED","finished_at":"2026-09-10T00:00:02Z","operands_digest":"2fa8ad5e610597ace4c18ae8dea46d7cd5c9f38e726e83a74c329f11fc007376","parser_id":"cpython-ast","parser_version":"3.10-profile","provider_id":"fixture-python-provider","provider_run_id":"56178c8b176896f6727cec8f942a7d5063caed4e422b6b34325b3b03a6dfde00","provider_version":"0.1","reported_fact_ids":["7a00cb5656f706ad97b236ed0cf239dbac84400d1845d557fb4444f7c12069f8","ffbec0037c18189f6d6af2e28ababcbed60b61a299ce58d1e0ca3f1cbcf15bf7"],"reported_relation_ids":["243fa6dba97154a6d6c7d712405640fb6f573573c359079b44cfb44ff7136089","67665e4c89ffb97521aba6ba221ba61d098258f2a899e38f03361d7324d328ff"],"runtime_id":"cpython","runtime_version":"3.10","started_at":"2026-09-10T00:00:01Z"}],"request_provenance":{"requested_ref":"refs/heads/fixture","requested_repository_id":"fixture/repository","resolved_at":"2026-09-10T00:00:00Z","resolver_id":"fixture-resolver","resolver_version":"0.1"},"schema_version":"0.1","slice_policy_digest":"6633300a034ccfa2fe4d60a55215cf3c792479a8cdbf23404e9024b50fb6f4a4","source_snapshot_digest":"3acb02f99805fd684ff68a1e0d2a2e24a22d75232564a1f52646c89e4398f747","started_at":"2026-09-10T00:00:00Z"}
